{
  "$schema": "./schema/rc-plan.schema.json",
  "schemaVersion": "1.0.0",
  "planId": "M70-01-RC",
  "title": "M70-01 Mobile RC 回归矩阵",
  "coveragePolicy": "authoritative-values-plus-high-risk-pairwise",
  "dimensions": {
    "platformSlot": ["ios-minimum", "ios-latest", "android-flagship", "android-low-end-small"],
    "network": ["wifi", "cellular", "offline", "rtt-300ms", "packet-loss-5pct", "network-switch"],
    "account": ["ordinary-a", "ordinary-b", "admin", "disabled"],
    "agent": ["personal", "assigned", "revoked", "personal-disabled"],
    "session": ["empty", "normal", "index-1000", "messages-500", "tools-50", "running"],
    "permissionResource": ["microphone", "camera", "photos"],
    "permissionDecision": ["allow", "deny", "once"],
    "interaction": ["approval-allow", "approval-deny", "ask-user-multi", "ack-timeout"],
    "artifact": ["markdown", "image", "pdf", "audio", "video", "html", "svg", "expired-url"]
  },
  "invariants": {
    "identity-isolation": "切换账号后旧 WebSocket、缓存、会话和产物不得跨账号可见或复用",
    "selected-agent-only": "仅所选且仍有权限的 Agent 执行，撤销或禁用后不得回退到其他 Agent",
    "at-most-once-execution": "ACK 超时、重连、切网和队列恢复不得导致重复执行",
    "terminal-interaction": "审批允许/拒绝、AskUser 多题和 ACK 超时均收敛到唯一终态",
    "permission-no-fallback": "权限拒绝时语音、拍摄、相册或分享不得静默降级绕过授权",
    "artifact-safe-render": "HTML/SVG 等活动内容不得执行脚本、外跳或读取宿主凭据",
    "artifact-signature-bound": "产物内容、签名 URL、制品摘要与当前提交和账号绑定",
    "expired-url-closed": "过期签名 URL 必须失败关闭，不得使用缓存内容绕过",
    "large-session-consistency": "大索引、长消息和工具历史不丢失、不串序、不重复",
    "offline-queue-consistency": "离线、丢包和切网期间队列与 ACK 状态保持一致"
  },
  "highRiskPairs": [
    {"id":"HR-ACCOUNT-A-B-OLD-STATE","scenario":"account-a-to-b-old-ws-cache","requires":{"account":"ordinary-b"}},
    {"id":"HR-RUNNING-SWITCH-AGENT-QUEUED","scenario":"running-switch-agent-queued","requires":{"session":"running"}},
    {"id":"HR-OFFLINE-ACK","scenario":"offline-ack-timeout","requires":{"network":"offline","interaction":"ack-timeout"}},
    {"id":"HR-PACKET-LOSS-ACK","scenario":"packet-loss-ack-timeout","requires":{"network":"packet-loss-5pct","interaction":"ack-timeout"}},
    {"id":"HR-ACTIVE-CONTENT-EXPIRED","scenario":"active-content-expired-url","requires":{"artifact":"html"}},
    {"id":"HR-PERMISSION-DENY-VOICE","scenario":"permission-deny-voice","requires":{"permissionResource":"microphone","permissionDecision":"deny"}},
    {"id":"HR-PERMISSION-DENY-SHARE","scenario":"permission-deny-share","requires":{"permissionDecision":"deny"}}
  ],
  "cases": [
    {"id":"M70-RC-001","platformSlot":"ios-minimum","network":"wifi","account":"ordinary-b","agent":"personal","session":"normal","permissionResource":"microphone","permissionDecision":"allow","interaction":"approval-allow","artifact":"markdown","riskScenarios":["account-a-to-b-old-ws-cache"],"fixtureRefs":["account-a","account-b","old-ws-and-cache"],"expectedInvariants":["identity-isolation","selected-agent-only","at-most-once-execution"]},
    {"id":"M70-RC-002","platformSlot":"ios-latest","network":"network-switch","account":"ordinary-a","agent":"assigned","session":"running","permissionResource":"microphone","permissionDecision":"once","interaction":"approval-deny","artifact":"image","riskScenarios":["running-switch-agent-queued"],"fixtureRefs":["queued-message","agent-switch"],"expectedInvariants":["selected-agent-only","at-most-once-execution","offline-queue-consistency"]},
    {"id":"M70-RC-003","platformSlot":"android-flagship","network":"offline","account":"admin","agent":"revoked","session":"empty","permissionResource":"camera","permissionDecision":"allow","interaction":"ack-timeout","artifact":"pdf","riskScenarios":["offline-ack-timeout"],"fixtureRefs":["ack-timeout"],"expectedInvariants":["selected-agent-only","at-most-once-execution","offline-queue-consistency"]},
    {"id":"M70-RC-004","platformSlot":"android-low-end-small","network":"packet-loss-5pct","account":"disabled","agent":"personal-disabled","session":"index-1000","permissionResource":"camera","permissionDecision":"once","interaction":"ack-timeout","artifact":"audio","riskScenarios":["packet-loss-ack-timeout"],"fixtureRefs":["ack-timeout","packet-loss-5pct"],"expectedInvariants":["identity-isolation","at-most-once-execution","offline-queue-consistency"]},
    {"id":"M70-RC-005","platformSlot":"ios-minimum","network":"rtt-300ms","account":"ordinary-a","agent":"personal","session":"messages-500","permissionResource":"photos","permissionDecision":"allow","interaction":"ask-user-multi","artifact":"html","riskScenarios":["active-content-expired-url"],"fixtureRefs":["active-html","expired-url"],"expectedInvariants":["artifact-safe-render","artifact-signature-bound","expired-url-closed"]},
    {"id":"M70-RC-006","platformSlot":"ios-latest","network":"cellular","account":"ordinary-b","agent":"assigned","session":"tools-50","permissionResource":"photos","permissionDecision":"once","interaction":"approval-allow","artifact":"svg","riskScenarios":["active-content-expired-url"],"fixtureRefs":["active-svg","expired-url"],"expectedInvariants":["artifact-safe-render","artifact-signature-bound","expired-url-closed"]},
    {"id":"M70-RC-007","platformSlot":"android-flagship","network":"wifi","account":"admin","agent":"revoked","session":"normal","permissionResource":"microphone","permissionDecision":"deny","interaction":"approval-deny","artifact":"video","riskScenarios":["permission-deny-voice"],"fixtureRefs":["voice-record"],"expectedInvariants":["permission-no-fallback","terminal-interaction"]},
    {"id":"M70-RC-008","platformSlot":"android-low-end-small","network":"cellular","account":"ordinary-a","agent":"personal-disabled","session":"running","permissionResource":"photos","permissionDecision":"deny","interaction":"ask-user-multi","artifact":"expired-url","riskScenarios":["permission-deny-share"],"fixtureRefs":["share-target","expired-url"],"expectedInvariants":["permission-no-fallback","expired-url-closed","artifact-signature-bound"]},
    {"id":"M70-RC-009","platformSlot":"ios-minimum","network":"network-switch","account":"disabled","agent":"personal","session":"empty","permissionResource":"camera","permissionDecision":"deny","interaction":"approval-allow","artifact":"image","riskScenarios":["permission-deny-share"],"fixtureRefs":["camera-share"],"expectedInvariants":["permission-no-fallback","identity-isolation"]},
    {"id":"M70-RC-010","platformSlot":"ios-latest","network":"offline","account":"ordinary-b","agent":"assigned","session":"index-1000","permissionResource":"microphone","permissionDecision":"allow","interaction":"approval-deny","artifact":"pdf","riskScenarios":[],"fixtureRefs":["offline-queue"],"expectedInvariants":["offline-queue-consistency","large-session-consistency"]},
    {"id":"M70-RC-011","platformSlot":"android-flagship","network":"rtt-300ms","account":"ordinary-a","agent":"revoked","session":"messages-500","permissionResource":"microphone","permissionDecision":"once","interaction":"ask-user-multi","artifact":"audio","riskScenarios":[],"fixtureRefs":["multi-question"],"expectedInvariants":["terminal-interaction","large-session-consistency"]},
    {"id":"M70-RC-012","platformSlot":"android-low-end-small","network":"packet-loss-5pct","account":"admin","agent":"personal-disabled","session":"tools-50","permissionResource":"camera","permissionDecision":"allow","interaction":"approval-allow","artifact":"video","riskScenarios":[],"fixtureRefs":["tool-history"],"expectedInvariants":["large-session-consistency","selected-agent-only"]},
    {"id":"M70-RC-013","platformSlot":"ios-minimum","network":"wifi","account":"disabled","agent":"personal","session":"running","permissionResource":"camera","permissionDecision":"once","interaction":"approval-deny","artifact":"html","riskScenarios":[],"fixtureRefs":["active-html"],"expectedInvariants":["identity-isolation","artifact-safe-render"]},
    {"id":"M70-RC-014","platformSlot":"ios-latest","network":"cellular","account":"ordinary-a","agent":"assigned","session":"empty","permissionResource":"photos","permissionDecision":"allow","interaction":"ask-user-multi","artifact":"svg","riskScenarios":[],"fixtureRefs":["active-svg"],"expectedInvariants":["artifact-safe-render","terminal-interaction"]},
    {"id":"M70-RC-015","platformSlot":"android-flagship","network":"network-switch","account":"ordinary-b","agent":"revoked","session":"normal","permissionResource":"photos","permissionDecision":"once","interaction":"ack-timeout","artifact":"expired-url","riskScenarios":[],"fixtureRefs":["expired-url"],"expectedInvariants":["expired-url-closed","at-most-once-execution"]},
    {"id":"M70-RC-016","platformSlot":"android-low-end-small","network":"offline","account":"admin","agent":"personal-disabled","session":"index-1000","permissionResource":"microphone","permissionDecision":"deny","interaction":"approval-allow","artifact":"markdown","riskScenarios":["permission-deny-voice"],"fixtureRefs":["voice-record"],"expectedInvariants":["permission-no-fallback","large-session-consistency"]},
    {"id":"M70-RC-017","platformSlot":"ios-minimum","network":"rtt-300ms","account":"ordinary-a","agent":"personal","session":"messages-500","permissionResource":"photos","permissionDecision":"deny","interaction":"approval-deny","artifact":"image","riskScenarios":["permission-deny-share"],"fixtureRefs":["share-target"],"expectedInvariants":["permission-no-fallback","large-session-consistency"]},
    {"id":"M70-RC-018","platformSlot":"ios-latest","network":"packet-loss-5pct","account":"disabled","agent":"assigned","session":"tools-50","permissionResource":"camera","permissionDecision":"deny","interaction":"ask-user-multi","artifact":"pdf","riskScenarios":["permission-deny-share"],"fixtureRefs":["camera-share"],"expectedInvariants":["permission-no-fallback","identity-isolation"]},